descricao_1,ean_1,titulo_1,url_1,titulo_cb_1,loja_1,descricao_2,ean_2,titulo_2,url_2,titulo_cb_2,loja_2,match
"Conjunto de 4 câmeras de 48MP com ia O Redmi 9T traz tudo aquilo que você precisa ter na palma da mão. Um conjunto de 4 câmeras com lentes que se completam e capturam fotos incríveis em qualquer ambiente, mais bateria para muitas horas de uso intenso, mais potência sonora e a clássica elegância dos smartphones da linha Redmi, que você já conhece. Resolução e nitidez, essas são as principais vantagens de se ter uma câmera principal com ia e sensor de 48MP. Somada a lente ultra-wilde de 8MP com campo de visão de 120°, você fotografa cenários inteiros com uma qualidade incrível até mesmo a longas distâncias. A lente macro de 2MP registra aquelas fotos mais intimistas, olhares artísticos que nos surpreendem com detalhes nítidos e belezas ampliadas a curta distância. A câmera frontal é ideal para selfies perfeitas, com 8MP e um sensor de profundidade de 2MP você faz retratos perfeitos com desfoque de fundo e nitidez em seu rosto. O Redmi 9T é uma verdadeira potência quando o assunto é bateria. São 6000mAh para você permanecer conectado o tempo todo, realizar chamadas de vídeos, horas e horas de jogos e as ligações para os amigos e familiares que estão distantes sem se preocupar com o nível de bateria restante. Com carregamento rápido de 18W e uma entrada USB tipo c, você garante o máximo de eficiência do smartphone, além de economizar tempo. O desing 3D fino traz a tecnoligia Corning Gorilla Glass 3 na parte frontal, protegendo a tela contra riscos em caso de quedas. Para desbloquear o seu Redmi 9T com mais conforto, inserimos o sensor de impressão digital na lateral, basta um toque rápido para acessar tudo o que você quiser. Você vai desfrutar de uma tela fhd + lcd de 6.53 com display Dot Drop de altíssima resolução. Ganhe mais aproveitamento de tela para curtir seus conteúdos favoritos com muita qualidade. Visualize tudo com níveis de contraste e brilho equilibrados, além da proteção TÜV Rheinland que ameniza a quantidade de luz azul, preservando a saúde dos seus olhos. Pensamos muito além da imagem para oferecer uma experiência completa. Através dos falantes duplos, você ganha mais potência e equilibro sonoro durante as chamadas de áudio e vídeo ou para ouvir podcasts e suas playlists favoritas. Se preferir ouvir com mais privacidade, basta conectar seu fone via Bluetooth 5.0 ou através da entrada P2. O desempenho do Redmi 9T fica por conta do processador Snapdragon 662, cpu octa-core de até 2.0 GHz e tecnologia de processamento de 11nm para uma performance totalmente fluida e otimizada. Atualizado com os sistemas miui 12 + Android q, seu Redmi 9T possui funções extras realmente úteis no dia a dia. Compatível com suporte para carregamento reverso, você pode conectar e carregar um outro smartphone via cabo USB tipo C nas duas pontas ou então transformar seu smartphone em um controle universal, através do sensor infravermelho. O Redmi 9T oferece suporte para Dual sim e um slot para cartão Micro sd, assim você alterna entre chips de operadoras diferentes e aumenta a capacidade de armazenamento das suas mídias.",7908426300397,Smartphone Xiaomi Redmi 9T 4GB + 64GB Bateria 6000mAh Câmera Quádrupla 48 + 8 + 2 + 2MP Tela 6.53 Azul,https://www.americanas.com.br/produto/4189785550,smartphone xiaomi redmi 9t 4gb + 64gb bateria 6000mah câmera quádrupla 48 + 8 + 2 + 2mp tela 6.53 azul,americanas,,0714578481375,samsung galaxy s20,https://www.amazon.com.br/Gen%C3%A9rico-1-samsung-galaxy-s20/dp/B00F0I9R42/ref=sr_1_218?qid=1651784049&s=wireless&sr=1-218&ufe=app_do%3Aamzn1.fos.95de73c3-5dda-43a7-bd1f-63af03b14751,samsung galaxy s20,amazon,0
"Sobre este item    6.39 ""HD Corning Gorilla Glass + Dotdisplay, Android 11    G95OCTA CORE 2.1GHZ 12NM Tela    RAM + ROM --8GB + 128GB    Samsung48MP + 8MP + 2MP + 2MP Quad Câmera traseira, Samsung 16MP Front Câmera    8500mAh (typ), suporte rápido33w carregamento rápido, cobrança sem fio 10w",0717994174128,Doogee S97 Pro 6.39 polegadas Android 11 Telefones Celular 40m Laser Ranging 48MP Quad Camera Helio G95 Octa Core 8500mAh 8GB + 128GB Smartphone NFC(Laranja）,https://www.amazon.com.br/polegadas-Android-Telefones-Smartphone-Laranja%EF%BC%89/dp/B09YPPZZHY/ref=sr_1_465?qid=1651784063&s=wireless&sr=1-465&ufe=app_do%3Aamzn1.fos.95de73c3-5dda-43a7-bd1f-63af03b14751,doogee s97 pro 6.39 polegadas android 11 telefones celular 40m laser ranging 48mp quad camera helio g95 octa core 8500mah 8gb + 128gb smartphone nfc(laranja）,amazon,"Multilaser G Max 2 com tela de 6.5 hd + u-notch para uma melhor navegação no aparelho e visualização de vídeos e fotos. Processador Octa Core, memória interna de 64GB, ram de 2GB e Android 11.0 Go deixam o aparelho com uma performance incrível. Tenha uma incrível experiência fotográfica com câmera tripla. Mais velocidade com conexão 4G e mais segurança e praticidade com sensor de digitais e reconhecimento facial. Características: Marca: Multilaser Modelo: G Max 2 P9157 Tela: Lcd Ips 6,5 hd Processador: Octa Core (1.6 + 1.2 Ghz) Rede: 4G Memória Ram: 2GB Armazenamento: 64GB Câmera Traseira Tripla: 8MP + vga + vga Câmera Frontal: 5MP Bateria: 4000 Mah Unidade De Medida: Pc Dimensões: Altura: 0,97 cm Comprimento: 16,52 cm Largura: 7,67 cm Peso Produto: 0,19 Kg Garantia do Fornecedor 12 meses",7908414420304,Smartphone GMax 2 P9157 Tela 6.5 64GB 2GB ram Multilaser,https://www.americanas.com.br/produto/4782017527,smartphone gmax 2 p9157 tela 6.5 64gb 2gb ram multilaser,americanas,0
"DescriçãoAlém do belo design, o Galaxy A02 oferece alto desempenho, experiência imersiva na grande tela e bateria poderosa. Assim, você pode aproveitar seus conteúdos em um smartphone focado em atividades básicas do dia a dia. O conjunto de câmeras, com sensores de 13 mp (principal) e 2 mp (macro) garantem os registros de seus momentos favoritos em belas fotos nítidas. Já na parte frontal há uma câmera de 5 mp que assegura selfies em alta resolução. Para assegurar desempenho nas atividades do dia a dia, o Galaxy A02 conta com 2 gb de memória ram e 32 gb de armazenamento (podendo ser expandida com cartão MicroSD de até 512GB (vendido separadamente). E a bateria de 5.000 mAh garante longas horas de uso sem necessidade de carregamento.DETALHESVeja ainda mais no Display Infinito: Com seu Display Infinito de 6.5"", o Galaxy A02 oferece uma experiência imersiva na tela grande. Assim, você pode aproveitar seus conteúdos em um belo design; Design fino com grande bateria: Com uma bateria grande dentro do dispositivo de 9.1 mm de espessura, o fino Galaxy A02 tem um design atraente com listras externas; Tire belas fotos com a câmera frontal ou traseira: Tire belas fotos nítidas de seus momentos favoritos com a câmera principal de 13 mp do Galaxy A02 ou fotografe os detalhes com a câmera macro de 2 mp. Quando quiser ser o foco, vire seu celular para usar a câmera frontal de 5 mp; Bateria duradoura: Jogue por mais tempo com a bateria de 5,000 mAh (padrão) do Galaxy A02. Sua capacidade maior permite que você passe menos tempo procurando por um carregador e mais tempo fazendo o que você ama no seu celular; Criado para oferecer desempenho ideal: O Galaxy A02 é feito para suas tarefas do cotidiano. Ele vem com 2 gb de memória ram para proporcionar desempenho estável e 32 gb de armazenamento interno. Adicione até 1 tb de espaço com cartões microSD; Concentre-se com o One ui Core: O One ui Core ajuda você a focar no que é realmente importante. Hardware e software trabalham juntos, com conteúdos e recursos na ponta de seus dedos para você encontrá-los mais rapidamente. Use o Modo Noturno para ter uma experiência confortável no escuro, e com visuais simples e intuitivos, usar seu celular é natural.ficha técnicaMarcaSamsungModeloGalaxy A02Memória interna32GB Total sendo uma parte usada para o sistema operacional e aplicativos pré-instaladosTela Infinita6.5""Conectividadeusb 2.0, Bluetooth v5, wi-fi 802.11 b/g/n 2.4GHzQuadriband gsmSimResolução do visor/display (pixels)720 x 1600 (hd + )ProcessadorQuad-Core de 1.5GHzRAM2GBTecnologiagsm; 3G; 4GTipo do Chip (Dual)Nano simBateria removívelNãoBateria (mAh)5000Câmera TraseiraCâmera Dupla Traseira de 13MP(Principal) + 2MP(Macro) e Flash-LEDCâmera FrontalCâmera frontal de 5MP com Flash na telaResolução câmera traseira dupla13MP(Principal) + 2MP(Macro)Resolução câmera frontal5.0 mpSomRádio fm / MP3 PlayerGrava vídeoSimSlot para cartãoMicroSD até 512GBCartão inclusoNãoRádio fmSimMP3 playerSimBluetoothSimWi-FiSimSuporte a gpsSimMensagenssms; mms; E-mailSistema OperacionalAndroid 10.0Garantia pelo Fornecedor12 mesesObs: Imagens meramente ilustrativas.",7892509118279,Smartphone Samsung Galaxy A02 A022 32GB,https://www.americanas.com.br/produto/4460735235,smartphone samsung galaxy a02 a022 32gb,americanas,H1f9 Acabamento Presilha e Parafusos dos flats do iPhone 5s Produto retirado de aparelhos de origem de leilão.,7794566483430,H1f9 Acabamento Presilha e Parafusos dos flats do iPhone 5s,https://www.americanas.com.br/produto/2215833270,h1f9 acabamento presilha e parafusos dos flats do iphone 5s,americanas,0
"Sobre este item    Botão SOS, faça chamadas de emergência com maior agilidade    Dual Chip, fale em dobro com até duas operadoras    Rádio FM    MP3 Player",7908414421783,Celular Multilaser Flip Vita Duo Dual Chip com duas telas + Botão SOS + Rádio FM + MP3 + Bluetooth + Câmera - Dourado – P9163,https://www.amazon.com.br/Celular-Multilaser-telas-Bluetooth-C%C3%A2mera/dp/B09VDQLZXC/ref=sr_1_2143?qid=1651784161&s=wireless&sr=1-2143&ufe=app_do%3Aamzn1.fos.95de73c3-5dda-43a7-bd1f-63af03b14751,celular multilaser flip vita duo dual chip com duas telas + botão sos + rádio fm + mp3 + bluetooth + câmera - dourado – p9163,amazon,"Sobre este item    6,8"" FHD + visor FullView grande, proporção cinematográfica 20,5:9, 1080 x 2460, Android 11, termômetro infravermelho digital sem contato 2.0    128GB + 8GB, CPU: MediaTek, Helio G80, 2*Cortex-A75+6*Cortex-A55, até 2,0GHz, GPU: ARM Mali-G52 MC2, até 950MHz    Câmera traseira: 48MP, F/1,79 + 16MP, F/2,2 + 5MP, Câmera frontal: Bateria 24MP, F/1,8, 5150mAh    2G GSM: B2/3/5/8, 3G: B1/2/4/5/6/8/19, 4G LTE: B1/2/3/4/5/7/8/12/13/17/18/19/25/26/28A/28B/34/38/39/40/41/41/66 - Dupla SIM    Modelo internacional - Sem garantia nos EUA. Compatível com a maioria das operadoras GSM como T-Mobile, AT&T, MetroPCS, etc. NÃO funcionará com operadoras de CDMA como Verizon, Cricket, Boost. ID FCC: 2ATZ4-A115X",6973553520896,"UMIDIGI A11 Pro Max (128 GB, 8 GB) Modelo internacional Dual SIM GSM Desbloqueado Global 4G LTE (Azul escuro)",https://www.amazon.com.br/UMIDIGI-Modelo-internacional-Desbloqueado-Global/dp/B09RVDF6XP/ref=sr_1_887?qid=1651784088&s=wireless&sr=1-887&ufe=app_do%3Aamzn1.fos.95de73c3-5dda-43a7-bd1f-63af03b14751,"umidigi a11 pro max (128 gb, 8 gb) modelo internacional dual sim gsm desbloqueado global 4g lte (azul escuro)",amazon,0
"Sobre este item    Tela grande: a tela grande do celular permite que você tenha uma visão mais ampla. Em jogos e vídeos, o conteúdo é mais exibido, mas o telefone ainda é pequeno e leve.    Processador poderoso: O processador potente melhora muito a velocidade da rede, a taxa de quadros e a suavidade da imagem durante jogos e multitarefa.    Sistema: O sistema é baseado no desenvolvimento em profundidade do sistema Android, que é mais completo e suave.    Câmeras duplas frontal e traseira de alta definição: câmera de alta definição para cores vivas e realistas, todas as fotos são lindas e as câmeras duplas frontal e traseira podem ser usadas de forma mais ampla.    Armazenamento expansível de 128 GB: Até 128 GB de armazenamento expansível, ele suporta o uso simultâneo de dois cartões SIM para dados e chamadas telefônicas, ou o uso simultâneo de um cartão SIM para dados e chamadas telefônicas e um cartão de memória para armazenamento de dados.",7376481608626,"Smartphone, display de alta definição universal de 4,66 polegadas smartphone 128 GB de armazenamento expansível cartões duplos em espera dupla para Android 4.4.2(azul)",https://www.amazon.com.br/Smartphone-defini%C3%A7%C3%A3o-smartphone-armazenamento-expans%C3%ADvel/dp/B09KYC2B6C/ref=sr_1_1996?qid=1651784154&s=wireless&sr=1-1996&ufe=app_do%3Aamzn1.fos.95de73c3-5dda-43a7-bd1f-63af03b14751,"smartphone, display de alta definição universal de 4,66 polegadas smartphone 128 gb de armazenamento expansível cartões duplos em espera dupla para android 4.4.2(azul)",amazon,"O Motorola Edge 30 Pro é o smartphone perfeito para você curtir todos os tipos de conteúdo. Ele possui as mais recentes tecnologias que permitem alto desempenho em qualquer tarefa, seja para o trabalho, estudo ou diversão. Conte com um avançado sistema de câmeras que possibilita a criação de fotos impressionantes. O Edge 30 Pro vem equipado com 12GB de ram, 256GB de armazenamento interno e processador Snapdragon Octa Core. Essa combinação entrega um desempenho poderoso para você fazer sempre mais. A tela Max Vision de 6.7 polegadas possui resolução fhd + e oferece uma incrível experiência visual com imagens mais nítidas e cores vibrantes. Um smartphone tão versátil como o Edge 30 Pro, não pode te deixar na mão. Para isso ele disponibiliza uma potente bateria, com autonomia suficiente para acompanhar o seu ritmo de vida real.",7892597351725,Smartphone Motorola Moto Edge 30 Pro 256GB 6.7 12GB ram Câm. Tripla 50MP 50MP 2MP Selfie 60MP - Azul,https://www.americanas.com.br/produto/4800764762,smartphone motorola moto edge 30 pro 256gb 6.7 12gb ram câm. tripla 50mp 50mp 2mp selfie 60mp - azul,americanas,0
Todas as informações divulgadas são de responsabilidade do fabricante/fornecedor.Verifique com os fabricantes do produto e de seus componentes eventuais limitações à utilização de todos os recursos e funcionalidades.Imagens Meramente Ilustrativas.,0194252041161,"iPhone 12 Pro Apple (512GB) Azul-pacífico tela 6,1"" Câmera tripla 12MP iOS",https://www.americanas.com.br/produto/2290966638,"iphone 12 pro apple (512gb) azul-pacífico tela 6,1"" câmera tripla 12mp ios",americanas,"Sobre este item    MEMÓRIA INTERNA - 256GB MEMÓRIA RAM - 6GB PROCESSADOR CPU - Qualcomm Snapdragon 860 Octa Core de 2.96GHz SISTEMA OPERACIONAL - Android 11 + MIUI Global 12.5.4 TELA - LCD de 11"" WQXG, 16:10 compatível com Dolby Vision CÂMERA - Principal de 13MP f/2.0 + Câmera Frontal de 8MP f/2.0 BATERIA - 8.720 mAh COMUNICAÇÃO - USB-C CARACTERÍSTICAS - Compatível com Smart Pen CONECTIVIDADE WIRELESS - Wi-Fi 802.11 a/b/g/n/ac, banda dupla 2.4GHz e 5GHz - Bluetooth 5.0 VÍDEO - Qualidade máxima de captura: 4K a 30 fps SENSOR - Giroscópio - Acelerômetro - Sensor de Proximidade ÁUDIO - Dolby ATMOS - Hi-Res Audio ALTO-FALANTE - Integrados, 4 no total MICROFONE - Integrados",6934177755675,Xiaomi Pad 5 Pearl White 6gb Ram 256gb,https://www.amazon.com.br/Xiaomi-Pad-Pearl-White-256gb/dp/B09DVKDHL1/ref=sr_1_333?qid=1651784055&s=wireless&sr=1-333&ufe=app_do%3Aamzn1.fos.95de73c3-5dda-43a7-bd1f-63af03b14751,xiaomi pad 5 pearl white 6gb ram 256gb,amazon,0
Sobre este item    Redmi Note 9S    Glacier White    6GB RAM 128GB,6941059643524,Redmi Note 9S Glacier White 6GB RAM 128GB,https://www.amazon.com.br/Redmi-Note-9S-Glacier-White/dp/B088HH1T6C/ref=sr_1_756?qid=1651784080&s=wireless&sr=1-756&ufe=app_do%3Aamzn1.fos.95de73c3-5dda-43a7-bd1f-63af03b14751,redmi note 9s glacier white 6gb ram 128gb,amazon,"DescriçãoFotografia profissional no seu bolso Descubra infinitas possibilidades para suas fotos com as 3 câmeras principais de sua equipe. Teste sua criatividade e jogue com iluminação, diferentes planos e efeitos para obter ótimos resultados. Seu zoom híbrido é perfeito para aqueles que amam os detalhes, pois integra o melhor do zoom óptico e digital para que você possa se aproximar dele sem perda de qualidade. Experiência visual incrível Assista às suas séries e filmes favoritos com a melhor definição na sua tela Dynamic amoled 2X de 6.2"". Desfrute de cores brilhantes e detalhes precisos em todo o seu conteúdo. Capacidade e eficiência Com seu poderoso processador e memória ram de 8 gb seu computador alcançará alto desempenho com alta velocidade de transmissão de conteúdos e executará vários aplicativos ao mesmo tempo, sem atrasos. Desbloqueio rápido com sua impressão digital Com o sensor de impressão digital, o acesso é seguro e você poderá desbloqueá-lo automaticamente com um toque. Vida útil da bateria mais longa Desconecte-se! Com a super bateria de 4000 mAh você terá energia por muito mais tempo para jogar, assistir séries ou trabalhar sem recarregar.",7892509117289,Samsung Galaxy S21 5G Dual sim 128 gb Cinza 8 gb ram,https://www.americanas.com.br/produto/4100367310,samsung galaxy s21 5g dual sim 128 gb cinza 8 gb ram,americanas,0
,6941059643036,"Xiaomi Smartphone Redmi Note 9S 4GB RAM + 64GB ROM, Preto",https://www.amazon.com.br/Xiaomi-Redmi-Note-9S-PRETO/dp/B085WB9VRQ/ref=sr_1_586?qid=1651784069&s=wireless&sr=1-586&ufe=app_do%3Aamzn1.fos.95de73c3-5dda-43a7-bd1f-63af03b14751,"xiaomi smartphone redmi note 9s 4gb ram + 64gb rom, preto",amazon,"Smartphone tcl L-10 plus 6.22 octa-core 64GB 2GB câmera tripla Se surpreenda com o Smartphone tcl L-10 Plus! Ele possui uma tela incrível de 6.22 Polegadas hd +, e com seu Processador Octa-Core juntamente com o Sistema Operacional Android 10 garante muito mais velocidade para o aparelho. Confira mais detalhes: Câmera tripla Sua câmera traseira tripla, conta com uma principal de 13 mp, outra grande angular com 5 mp com lente de 120º e uma de profundidade de 2 mp. Assim, vão te proporcionar uma maior qualidade para suas fotos! Além disso, sua câmera frontal tem 5MP para você registrar suas melhores selfies! Memória para armazenar mais Ah! E não poderia esquecer da Memória com incríveis 64GB de Armazenamenro e 2GB de ram, ideais para você guardar todas as lembranças dos momentos especiais, sem sobrecarregar seu aparelho! Bateria que dura! E fique despreocupado pois sua Bateria de 4000 mAh vai te acompanhar por onde for. Sobre a marca: Revolução Semp tcl A Semp tcl, está há 77 anos no mercado, sendo uma empresa que vem revolucionando a trajetória da tecnologia brasileira, uma das maiores fabricantes de TV e a primeira a fabricar aparelhos televisores no Brasil. Hoje é líder Global em Android tv. A junção da semp e tcl é o melhor de dois mundos inovando para você. Além disso semp se preocupa com o esporte brasileiro patrocinando a seleção masculina e feminina de futebol e o comitê paralímpico brasileiro, apoiando esses atletas que inspira o Brasil por meio do esporte. Características: Marca: tcl Modelo: 5130I Linha: L-10 Tamanho da tela: 6,22 Polegadas Tecnologia da tela: tft ips Resolução da tela: 720 x 1520 hd + Sistema operacional: Android 10 Processador: Octa core Velocidade do processador: 1.6 GHz Memória interna:64 gb Memória ram: 2 gb Expansão de memória: Até 128 gb Tipo de chip: 4FF e Nano-SIM Quantidade de chips: 2 chips Tecnologia:2G/3G/4G Resolução câmera traseira:13 Mp (principal) + 5 Mp (grande angular) + 2 Mp (profundidade) Resolução câmera frontal: 5 Mp Flash: lcd Bluetooth: Versão 4.2 Wi-Fi: 802.11b/g/n Tipo de conector: Micro usb Capacidade da bateria: 4000 mAh Carregamento sem fio: Não nfc: Não Mensagens: sms Leitor biométrico: Não Sensores: gps, agps, Acelerômetro, Proximidade, Luz, Fingerprint e Reconhecimento facial Resistência a água: Não Rádio fm: Sim Visualizador de arquivos: Sim Itens Inclusos: 01 Smartphone 01 carregador 01 cabo USB 01 fone de ouvido 01 chave de remoção do sim 01 película protetora de tela 01 capa protetora kit de manuais. Dimensões do Produto: Altura: 15,91 cm Largura: 7,52 cm Profundidade: 0,86 cm Peso: 0,17 kg Garantia do fornecedor: 12 meses (3 meses de garantia legal e mais 9 meses de garantia especial concedida pelo fabricante). Detalhes sobre a compra: Fique de olho: siga sempre as orientações do fabricante e utilize seu produto de acordo com o manual. A empresa não se responsabiliza pelo mau uso do produto, o que pode causar perda da garantia. #8239; Não nos encarregamos, no ato da entrega, por montagens e desmontagens, subir escadas/elevadores ou transporte por guincho para apartamentos. Eventuais despesas são de responsabilidade do cliente. O valor divulgado é unitário e a imagem é meramente ilustrativa. Precisou trocar ou devolver? O prazo é de 7 dias a partir do recebimento do produto - Lei nº 8.078 Sempre confira no ato da entrega.",7898552004880,Smartphone tcl L-10 Plus 6.22 Polegadas Octa-Core 64GB 2GB Câmera Tripla,https://www.americanas.com.br/produto/4846446997,smartphone tcl l-10 plus 6.22 polegadas octa-core 64gb 2gb câmera tripla,americanas,0
Todas as informações divulgadas são de responsabilidade do fabricante/fornecedor.Verifique com os fabricantes do produto e de seus componentes eventuais limitações à utilização de todos os recursos e funcionalidades.Imagens Meramente Ilustrativas.,0194252014301,"iPhone 12 Mini Apple (64GB) Verde tela 5,4"" Câmera dupla 12MP iOS",https://www.americanas.com.br/produto/2291347100,"iphone 12 mini apple (64gb) verde tela 5,4"" câmera dupla 12mp ios",americanas,"Experiência de visualização nítida Uma tela extraordinária para uma experiência de visualização mais ampla e realista. Reprodução de cores vivas. O projeto de tela aprimorado e mais amplo faz com que as imagens e vídeos pareçam saltar para fora da tela. Mais Brilho e Nitidez nas Fotos Capture imagens brilhantes em cada ocasião com a câmera traseira de 5 MP com abertura de f / 2.2 e frontal de 2MP. Tire fotos mais nítidas e sem ruído, mesmo em condições de baixa luminosidade. Mais Carga na Bateria Use seu telefone por ainda mais tempo com a nova e aperfeiçoada bateria de 2050 mAh. A bateria está acabando? Isso não é problema! Reduza seu uso de bateria com o modo de economia de energia Ultra Power Saving. Desempenho Aprimorado Equipado com processador Quad de 1.3 GHz e 1 GB de RAM, o desempenho potente agora está ao seu alcance. Aproveite mais a sua navegação na Internet, assista a vídeos e curta jogos com uma velocidade de tirar o fôlego. Gerenciador Inteligente Prático e Acessível O aplicativo interativo Smart Manager permite monitorar e gerenciar as funções essenciais do seu aparelho de forma simples com apenas alguns toques. Verifique seus níveis de bateria, armazenamento, uso de RAM e segurança - tudo com uma olhada rápida na tela. Entretenimento e conectividade em suas mãos! ATENÇÃO! Caso for utilizar um cartão de memória, recomendamos o uso de um cartão MICRO SD de alta performance, classe 10. Conteúdos (de alta qualidade) que requerem altos usos da memória RAM afetarão o desempenho geral do aparelho. Aplicações relacionadas ao conteúdo podem não funcionar adequadamente dependendo das especificações do aparelho e do ambiente em que é utilizado. Imagens Meramente Ilustrativas. Todas as Informações divulgadas são de responsabilidade do Fabricante/Fornecedor. Verifique com os fabricantes do produto e de seus componentes eventuais limitações à utilização de todos os recursos e funcionalidades.",7892509085021,"Smartphone Samsung Galaxy J1 2016 Dual Chip Android 5.1 Tela 4.5"" 8GB Wi-Fi 3G Câmera 5MP - Dourado",https://www.americanas.com.br/produto/125633434,"smartphone samsung galaxy j1 2016 dual chip android 5.1 tela 4.5"" 8gb wi-fi 3g câmera 5mp - dourado",americanas,0
,7898567779049,Smartphone Xiaomi Redmi 9C 64GB (Cinza) - Homologado Anatel,https://www.amazon.com.br/Smartphone-Xiaomi-Redmi-64GB-Cinza/dp/B08N2S6Q5Z/ref=sr_1_948?qid=1651784092&s=wireless&sr=1-948&ufe=app_do%3Aamzn1.fos.95de73c3-5dda-43a7-bd1f-63af03b14751,smartphone xiaomi redmi 9c 64gb (cinza) - homologado anatel,amazon,"Compatível com quase todos os dispositivos habilitados para tomada de 3,5 mm, como celular, smartphone, laptop, computador etc.    Design estilo telefone, conveniente para falar e ouvir.    Interior de alto falante, oferece voz clara.    Uso manual e ombro disponíveis.    Amplamente utilizado durante atividades militares, delegacia, caça, jogo de tiro, equipe para explorar, local de construção e outros lugares que exigem comunicação rápida e fácil.",0735752062104,"Ciglow Microfone de alto-falante portátil 3,5 mm entrada de áudio para smartphone design estilo telefone celular compatível com dispositivos habilitados com quase 3,5 mm",https://www.amazon.com.br/Ciglow-alto-falante-smartphone-dispositivos-habilitados/dp/B07V2QX6G5/ref=sr_1_2566?qid=1651784181&s=wireless&sr=1-2566&ufe=app_do%3Aamzn1.fos.95de73c3-5dda-43a7-bd1f-63af03b14751,"ciglow microfone de alto-falante portátil 3,5 mm entrada de áudio para smartphone design estilo telefone celular compatível com dispositivos habilitados com quase 3,5 mm",amazon,0
