descricao_1,ean_1,titulo_1,url_1,titulo_cb_1,loja_1,descricao_2,ean_2,titulo_2,url_2,titulo_cb_2,loja_2,match
Sobre este item    Função de hotspot móvel    Com bluetooth    Memória expansível de até 512 GB    Dual SIM    Câmera dupla    Processador Octa Core    GPS integrado    Quad Band,8906129031876,Smartphone Xiaomi Redmi 9i Sport 64gb / 4gb Ram Tela 6.53 - Carbon Black,https://www.amazon.com.br/Smartphone-Xiaomi-Redmi-Sport-64gb/dp/B09HSKYMB3/ref=sr_1_1352?qid=1651784116&s=wireless&sr=1-1352&ufe=app_do%3Aamzn1.fos.95de73c3-5dda-43a7-bd1f-63af03b14751,smartphone xiaomi redmi 9i sport 64gb / 4gb ram tela 6.53 - carbon black,amazon,,6934177736889,Celular Xiaomi Mi 11 Lite 8/128 Azul Versão Global,https://www.amazon.com.br/Celular-Xiaomi-Lite-Vers%C3%A3o-Global/dp/B098PC9L9S/ref=sr_1_655?qid=1651784074&s=wireless&sr=1-655&ufe=app_do%3Aamzn1.fos.95de73c3-5dda-43a7-bd1f-63af03b14751,celular xiaomi mi 11 lite 8/128 azul versão global,amazon,0
"Sobre este item    【CONSIDERE APÓS O SERVIÇO】 Oferecemos uma garantia de 90 dias sem motivo para troca ou devolução. Todos os produtos em nossa loja passaram por rigorosa inspeção de qualidade, e produtos com indicadores não qualificados nunca sairão de nossa fábrica. E se você tiver alguma dúvida ou preocupação sobre nossos produtos, entre em contato conosco.    【O PRESENTE IDEAL】 Esses smartphones de telefones com conversa direta são de acabamento requintado e muitas funções práticas, fazem do nosso telefone Android um presente fantástico para enviar a seus amigos ou familiares. O sistema mais estável lhe dará uma experiência de uso incomparável. COMPRE COM SUA CONFIANÇA.    【TELA DE 6,72IN】Este celular equipado com tela grande de 6,72 polegadas, que oferece um campo de visão mais amplo em jogos e vídeos, permite que você experimente um campo mais amplo, mais conteúdo é exibido e o telefone ainda é pequeno e CPU de processador poderoso leve.plus, a suavidade da velocidade de execução da rede, taxa de quadros e exibição de imagem durante a navegação pode ser melhorada ao máximo.    【2300mAh, DUAL SIM】 Bateria de 2400mAh, suportando o uso simultâneo de dois cartões SIM para dados e chamadas telefônicas, 3G (WCDMA850/2100, espera dupla de cartão duplo de frequência GSM4, para cartão Nano SIM) ou uso simultâneo de cartões de memória para armazenamento de dados. mais conteúdos podem ser baixados e exibidos.    【FACE ID UNLOCK】Câmera de alta definição, câmeras frontais 2 e traseiras de 2 milhões de pixels, cores vivas, cada foto é tão bonita quanto papel de parede, desenvolvimento em profundidade, mais completo e suave. Ele suporta o desbloqueio de Face ID, proporcionando uma experiência de ficção científica.",7359653631516,"Smartphone Android X66 PRO+ desbloqueado - telefone celular de 6,72 polegadas 2 + 16 GB cartão duplo smartphone de espera dupla Com função de câmera de beleza, Android 8.1(azul)",https://www.amazon.com.br/Smartphone-Android-X66-PRO-desbloqueado/dp/B09T6PPPQ1/ref=sr_1_1509?qid=1651784125&s=wireless&sr=1-1509&ufe=app_do%3Aamzn1.fos.95de73c3-5dda-43a7-bd1f-63af03b14751,"smartphone android x66 pro+ desbloqueado - telefone celular de 6,72 polegadas 2 + 16 gb cartão duplo smartphone de espera dupla com função de câmera de beleza, android 8.1(azul)",amazon,,7892509117654,Smartphone Samsung Galaxy A10s 32GB 4G Wi-Fi Tela 6.2'' Dual Chip 2GB RAM Câmera Dupla + Selfie 8MP - Vermelho,https://www.amazon.com.br/Smartphone-Samsung-Galaxy-C%C3%A2mera-Selfie/dp/B0921912LY/ref=sr_1_1223?qid=1651784108&s=wireless&sr=1-1223&ufe=app_do%3Aamzn1.fos.95de73c3-5dda-43a7-bd1f-63af03b14751,smartphone samsung galaxy a10s 32gb 4g wi-fi tela 6.2'' dual chip 2gb ram câmera dupla + selfie 8mp - vermelho,amazon,0
"Conjunto de Câmeras de 108MP, Lente Telemacro, Tela 120Hz amoled de 6.67 com DotDisplay, Processador Qualcomm Snapdragon 732G, carregamento ultrarrápido de 33 w. Novas tecnologias, tela amoled ainda maior e melhor, 120Hz de atualização, o conjunto de câmeras mais poderoso da categoria, é o que o queridinho da série Note 10 vai te entregar. Conheça o Redmi Note 10 pro e surpreenda-se com as inovações inseridas. O conjunto de câmeras coloca 108MP nas suas mãos e oferece à sua experiência fotográfica, visual e criativa, um resultado profissional. A câmera traseira principal é ultra angular e, além de capturar imagens ultra nítidas, valorizam os detalhes das sombras e das partes iluminadas das fotos. Somada à segunda lente ultra angular de 8MP com campo de visão de 118° para o registro de paisagens completas, ao sensor de profundidade de 2MP, à câmera frontal de 16MP para selfies e retratos com muito mais qualidade, o Redmi Note 10 pro traz uma lente telemacro de 5MP. Tire fotos ampliadas com a muito mais resolução, clareza e precisão e sem a necessidade de se aproximar dos objetos, paisagens ou o que quiser fotografar. Entre as melhorias das ferramentas visuais, está o novo modo noturno 2.0, que usa um algoritmo multi-frame avançado, que combina fotos no formato profissional raw e entregam imagens cristalinas. Com os novos modos time lapse Pro, Dual Video, Longa exposição e estabilizador de imagens, você tem um estúdio móvel nas mãos para criar um conteúdo incrível. A Tela amoled está maior, são 6.67 com DotDisplay com taxa de 120Hz de atualização, isso significa uma experiência totalmente fluida em jogos e no uso geral do seu smartphone, além dos impressionantes 240Hz de amostra de toque, para mais sensibilidade e latência baixa que resulta em uma tela mais responsiva ao toque. O modo leitura 3.0 dá a impressão real de leitura de um livro e, com o modo sunlight 2.0, você poderá visualizar a tela tranquilamente em qualquer ambiente com muita incidência de luz. Conte com a proteção Corning Gorilla Glass 5 na parte frontal, que aliada à certificação sgs de baixa luz azul, mantém a saúde dos seus olhos em dia, evitando cansaços desnecessários. O Redmi Note 10 Pro, possui alto-falantes duplos para intensificar a sua imersão durante os jogos, músicas, séries e filmes favoritos. Se preferir, use fones e elimine os ruídos externos, basta conectá-los a entrada P2 ou fazer o pareamento via Bluetooth. Inserimos o avançado motor de vibração Z-axis para aumentar a sensação de imersão durante o seu entretenimento. Sinta na ponta dos dedos reações diferentes para sons e movimentos e eleve o nível de intensidade da sua experiência audiovisual. Com sensor lateral de impressão digital integrado ao corpo do smartphone, fica muito mais rápido e confortável desbloquear o seu Redmi Note 10 Pro. Se preferir, acesse o smartphone de forma prática, através do desbloqueio facial. O processador Qualcomm Snapdragon 732G de 8nm é perfeito para os aplicativos mais pesados. Você vai se surpreender com a eficiência e performance otimizada do seu Redmi Note 10 Pro. O suporte da bateria aumentou, são 5020mAh de alta capacidade e durabilidade para manter o smartphone funcionando mesmo sob o uso intenso. Quando precisar de uma recarga e bateria, com os 33 W de potência disponibilizados, o seu carregamento será ultrarrápido e 100% eficaz. O Redmi Note 10 Pro conta com nfc multifuncional, um sensor infravermelho para controlar sua smart tv e outros dispositivos inteligentes da sua casa ou escritório, além de oferecer slot Dual sim, que possibilita que você alterne entre chips de operadores diferentes e permaneça conectado sempre que quiser.",7908426300847,"Smartphone Xiaomi Redmi Note 10 Pro Tela 6,67 6GB 128GB Bateria 5020mAh Câmeras 108 + 8 + 5 + 2MP Bronze",https://www.americanas.com.br/produto/4157516523,"smartphone xiaomi redmi note 10 pro tela 6,67 6gb 128gb bateria 5020mah câmeras 108 + 8 + 5 + 2mp bronze",americanas,"Experiência de visualização nítida Uma tela extraordinária para uma experiência de visualização mais ampla e realista. Reprodução de cores vivas. O projeto de tela aprimorado e mais amplo faz com que as imagens e vídeos pareçam saltar para fora da tela. Mais Brilho e Nitidez nas Fotos Capture imagens brilhantes em cada ocasião com a câmera traseira de 5 MP com abertura de f / 2.2 e frontal de 2MP. Tire fotos mais nítidas e sem ruído, mesmo em condições de baixa luminosidade. Mais Carga na Bateria Use seu telefone por ainda mais tempo com a nova e aperfeiçoada bateria de 2050 mAh. A bateria está acabando? Isso não é problema! Reduza seu uso de bateria com o modo de economia de energia Ultra Power Saving. Desempenho Aprimorado Equipado com processador Quad de 1.3 GHz e 1 GB de RAM, o desempenho potente agora está ao seu alcance. Aproveite mais a sua navegação na Internet, assista a vídeos e curta jogos com uma velocidade de tirar o fôlego. Gerenciador Inteligente Prático e Acessível O aplicativo interativo Smart Manager permite monitorar e gerenciar as funções essenciais do seu aparelho de forma simples com apenas alguns toques. Verifique seus níveis de bateria, armazenamento, uso de RAM e segurança - tudo com uma olhada rápida na tela. Entretenimento e conectividade em suas mãos! ATENÇÃO! Caso for utilizar um cartão de memória, recomendamos o uso de um cartão MICRO SD de alta performance, classe 10. Conteúdos (de alta qualidade) que requerem altos usos da memória RAM afetarão o desempenho geral do aparelho. Aplicações relacionadas ao conteúdo podem não funcionar adequadamente dependendo das especificações do aparelho e do ambiente em que é utilizado. Imagens Meramente Ilustrativas. Todas as Informações divulgadas são de responsabilidade do Fabricante/Fornecedor. Verifique com os fabricantes do produto e de seus componentes eventuais limitações à utilização de todos os recursos e funcionalidades.",7892509085021,"Smartphone Samsung Galaxy J1 2016 Dual Chip Android 5.1 Tela 4.5"" 8GB Wi-Fi 3G Câmera 5MP - Dourado",https://www.americanas.com.br/produto/125633434,"smartphone samsung galaxy j1 2016 dual chip android 5.1 tela 4.5"" 8gb wi-fi 3g câmera 5mp - dourado",americanas,0
"iPhone 13. O sistema de câmera dupla mais avançado em um iPhone. Chip A15 Bionic com velocidade impressionante. Um grande salto em bateria. Design resistente. 5G ultrarra´pido1. E tela Super Retina XDR mais brilhante. Avisos legais 1.E´ preciso ter um plano de dados. 5G só´ esta´ disponível em alguns países e por meio de determinadas operadoras. As velocidades variam de acordo com as condições e operadoras locais. Para obter detalhes sobre a compatibilidade com 5G, entre em contato com sua operadora e consulte apple.com/br/iphone/cellular. 2.A tela tem bordas arredondadas que se ajustam ao design curvo do aparelho dentro da sua forma retangular. Quando medida como um retângulo, a tela tem 6,06 polegadas na diagonal. A área real de visualização e´ menor. 3.A duração da bateria varia de acordo com o uso e a configuração. Consulte apple.com/br/batteries para obter mais informações. 4.O iPhone 13 e´ resistente a respingos, água e poeira e foi testado em condições controladas em laboratório, classificado como IP68 segundo a norma IEC 60529. A resistência a respingos, água e poeira não e´ uma condição permanente e pode diminuir com o tempo. Não tente recarregar um iPhone molhado. Veja instruções de limpeza e secagem no Manual do Usuário. Danos decorrentes de contato com líquidos não estão incluídos na garantia. 5.Alguns recursos podem não estar disponíveis em todos os países ou regiões. 6.Os acessórios são vendidos separadamente. Especificações Consulte apple.com/br/iphone/compare para ver todas as especificações. Imagens meramente ilustrativas.Todas as informações divulgadas são de responsabilidade do Fabricante/Fornecedor.Verifique com os fabricantes do produto e de seus componentes eventuais limitações à utilização de todos os recursos e funcionalidades.A memória interna disponível para o usuário pode variar de acordo com o sistema operacional e aplicativos instalados no dispositivo.",0194252709481,iPhone 13 Apple 256GB iOS 5G Wi-Fi Tela 6.1'' Câmera Dupla 12MP - Azul,https://www.americanas.com.br/produto/4864623184,iphone 13 apple 256gb ios 5g wi-fi tela 6.1'' câmera dupla 12mp - azul,americanas,Todas as informações divulgadas são de responsabilidade do fabricante/fornecedor. Verifique com os fabricantes do produto e de seus componentes eventuais limitações à utilização de todos os recursos e funcionalidades. Imagens Meramente Ilustrativas.,7892509114295,Smartphone Samsung Galaxy M31 128GB 4G Wi-Fi Tela 6.4'' Dual Chip 6GB RAM Câmera Quádrupla + Selfie 32MP - Preto,https://www.americanas.com.br/produto/1739672542,smartphone samsung galaxy m31 128gb 4g wi-fi tela 6.4'' dual chip 6gb ram câmera quádrupla + selfie 32mp - preto,americanas,0
"Funcionalidades: - Desbloqueio Smartphone (Disponível somente para Android 5.0 ou superior) - Monitoramento de distâncias percorridas e calorias queimadas - Monitoramento Cardiáco - Relógio - Monitoriamento do sono (aplicativo dispõe de gráficos analíticos sobre sua noite de sono) - Alarme inteligente - Histórico dos dados no aplicativo (pode ser sincronizado com os apps de saúde do Android e ios) - Alerta vibratório ao receber ligações - Alertas dos aplicativos (Whatsappp, Facebook, Twitter, Wechat, Snapchat, etc) Itens Inclusos: 1x Pulseira na cor Preta 1x Núcleo (Mi Band 3) 1x Cabo Carregador (Atenção, não adaptar no carregador de celular) 1x Película",7901534404711,Xiaomi Mi Band 3 + Fone Bluetooth,https://www.americanas.com.br/produto/1349870834,xiaomi mi band 3 + fone bluetooth,americanas,"Sobre este item    Tela de 5,5 polegadas: O 12pro oferece a experiência de visualização que você sempre quis, com uma enorme proporção de tela para corpo de 80% em uma tela de 5,5 polegadas.    Câmera frontal de 24MP selfie clara e elegante: A câmera frontal de 24MP líder mundial da 12pro transforma cada selfie em uma obra de arte, experimente maior brilho, vibração de cores, clareza e alcance dinâmico. Mesmo com pouca luz, sempre que você precisar, seu 12pro está com você, capturando cada momento com precisão cristalina, transforme suas selfies em obras-primas e brilhe em todas as fotos.    Câmera HD traseira de 48MP：O 12pro possui uma combinação de câmeras de 48MP. A câmera principal possui uma grande abertura f / 1.8 e pixels de 1.28um, Esta combinação forte aumenta a sensibilidade à foto em contraluz ou com pouca luz, basta apontar e disparar e o 12pro garantirá que suas fotos permaneçam claras e brilhantes.    Desempenho poderoso: A plataforma móvel MTK6983 com tecnologia de processo de 10 mm torna os jovens que amam os jovens e outros jogos populares. O jogo está ligado e mais baixo.    Android 10.0：O novo design interativo torna a operação simples e simples, o uso do telefone celular é tão simples e direto, tudo é prático.",6094963197949,12pro 5G Desbloqueado Smartphone Android 10.0 Dual Sim Em Espera Dupla 5.5 Polegada Tela 4GB RAM + 64GB ROM Memória Bateria De Íon De Lítio De 4800mAh 24MP+48MP Câmera (Color : Purple),https://www.amazon.com.br/Desbloqueado-Smartphone-Android-Polegada-Mem%C3%B3ria/dp/B09YDGXRT3/ref=sr_1_1567?qid=1651784129&s=wireless&sr=1-1567&ufe=app_do%3Aamzn1.fos.95de73c3-5dda-43a7-bd1f-63af03b14751,12pro 5g desbloqueado smartphone android 10.0 dual sim em espera dupla 5.5 polegada tela 4gb ram + 64gb rom memória bateria de íon de lítio de 4800mah 24mp+48mp câmera (color : purple),amazon,0
,6971409205454,Xiaomi Black Shark 4 Dual Sim 5G 128 Gb Mirror Black 8 Gb Ram Tela 144 Hz HDR10+ Snapdragon 870,https://www.amazon.com.br/Xiaomi-Black-Shark-Mirror-Snapdragon/dp/B093BDG3G5/ref=sr_1_266?qid=1651784052&s=wireless&sr=1-266&ufe=app_do%3Aamzn1.fos.95de73c3-5dda-43a7-bd1f-63af03b14751,xiaomi black shark 4 dual sim 5g 128 gb mirror black 8 gb ram tela 144 hz hdr10+ snapdragon 870,amazon,,7892509120623,Smartphone Samsung Galaxy A52s 5G 128GB 6.5 6GB Branco,https://www.amazon.com.br/Smartphone-Galaxy-A52s-5G-128GB/dp/B09NC9VKHG/ref=sr_1_591?qid=1651784069&s=wireless&sr=1-591&ufe=app_do%3Aamzn1.fos.95de73c3-5dda-43a7-bd1f-63af03b14751,smartphone samsung galaxy a52s 5g 128gb 6.5 6gb branco,amazon,0
Todas as informações divulgadas são de responsabilidade do fabricante/fornecedor. Verifique com os fabricantes do produto e de seus componentes eventuais limitações à utilização de todos os recursos e funcionalidades. Imagens Meramente Ilustrativas.,7892509114295,Smartphone Samsung Galaxy M31 128GB 4G Wi-Fi Tela 6.4'' Dual Chip 6GB RAM Câmera Quádrupla + Selfie 32MP - Preto,https://www.americanas.com.br/produto/1739672542,smartphone samsung galaxy m31 128gb 4g wi-fi tela 6.4'' dual chip 6gb ram câmera quádrupla + selfie 32mp - preto,americanas,"iPhone 13. O sistema de câmera dupla mais avançado em um iPhone. Chip A15 Bionic com velocidade impressionante. Um grande salto em bateria. Design resistente. 5G ultrarra´pido1. E tela Super Retina XDR mais brilhante. Avisos legais 1.E´ preciso ter um plano de dados. 5G só´ esta´ disponível em alguns países e por meio de determinadas operadoras. As velocidades variam de acordo com as condições e operadoras locais. Para obter detalhes sobre a compatibilidade com 5G, entre em contato com sua operadora e consulte apple.com/br/iphone/cellular. 2.A tela tem bordas arredondadas que se ajustam ao design curvo do aparelho dentro da sua forma retangular. Quando medida como um retângulo, a tela tem 6,06 polegadas na diagonal. A área real de visualização e´ menor. 3.A duração da bateria varia de acordo com o uso e a configuração. Consulte apple.com/br/batteries para obter mais informações. 4.O iPhone 13 e´ resistente a respingos, água e poeira e foi testado em condições controladas em laboratório, classificado como IP68 segundo a norma IEC 60529. A resistência a respingos, água e poeira não e´ uma condição permanente e pode diminuir com o tempo. Não tente recarregar um iPhone molhado. Veja instruções de limpeza e secagem no Manual do Usuário. Danos decorrentes de contato com líquidos não estão incluídos na garantia. 5.Alguns recursos podem não estar disponíveis em todos os países ou regiões. 6.Os acessórios são vendidos separadamente. Especificações Consulte apple.com/br/iphone/compare para ver todas as especificações. Imagens meramente ilustrativas.Todas as informações divulgadas são de responsabilidade do Fabricante/Fornecedor.Verifique com os fabricantes do produto e de seus componentes eventuais limitações à utilização de todos os recursos e funcionalidades.A memória interna disponível para o usuário pode variar de acordo com o sistema operacional e aplicativos instalados no dispositivo.",0194252708132,iPhone 13 Apple 128GB iOS 5G Wi-Fi Tela 6.1'' Câmera Dupla 12MP - Azul,https://www.americanas.com.br/produto/4864624161,iphone 13 apple 128gb ios 5g wi-fi tela 6.1'' câmera dupla 12mp - azul,americanas,0
,8906129031975,Celular Xiaomi Redmi 9 Activ Dual 6Gb Ram 128Gb - Coral Green,https://www.amazon.com.br/Celular-Xiaomi-Redmi-Activ-128Gb/dp/B09GFMFTHS/ref=sr_1_1209?qid=1651784108&s=wireless&sr=1-1209&ufe=app_do%3Aamzn1.fos.95de73c3-5dda-43a7-bd1f-63af03b14751,celular xiaomi redmi 9 activ dual 6gb ram 128gb - coral green,amazon,"Sobre este item    ATENÇÃO: VERSÃO INDIANA, COM ROM GLOBAL, CARREGADOR VAI COM ADAPTADOR.",6934177738180,Smartphone Poco X3 PRO 256gb 8gb RAM – Phantom Black - Preto,https://www.amazon.com.br/Smartphone-Poco-PRO-256gb-8gb/dp/B0919PLV7S/ref=sr_1_564?qid=1651784068&s=wireless&sr=1-564&ufe=app_do%3Aamzn1.fos.95de73c3-5dda-43a7-bd1f-63af03b14751,smartphone poco x3 pro 256gb 8gb ram – phantom black - preto,amazon,0
,7892509120500,"Smartphone Samsung Galaxy Z Flip3 128GB 5G - Verde, RAM 8GB, TELA 6.7"" Câmeras Traseiras 12.0 MP + 12.0 MP, Câmera Frontal 10.0 MP, Processador Octa Core",https://www.amazon.com.br/Smartphone-Samsung-Galaxy-Flip3-128GB/dp/B09RV7G8SL/ref=sr_1_106?qid=1651784042&s=wireless&sr=1-106&ufe=app_do%3Aamzn1.fos.95de73c3-5dda-43a7-bd1f-63af03b14751,"smartphone samsung galaxy z flip3 128gb 5g - verde, ram 8gb, tela 6.7"" câmeras traseiras 12.0 mp + 12.0 mp, câmera frontal 10.0 mp, processador octa core",amazon,"Chegou a hora de se conectar ao mundo tecnológico! O Smartphone Moto G71 da Motorola é e equipado com tecnologia 5G e processador Snapdragon® 695, que dá mais velocidade e qualidade para as suas tarefas diárias. Desenvolvido com o design de ponta moderno, conta com uma estrutura curva e bordas arredondadas, o que deixa ainda mais incrível. Sua tela OLED possui 6.4”, e produz imagens cristalinas, com brilho e cores impressionantes. Ideal para assistir séries e filmes com alta qualidade. Veja em tons vibrantes e mais realistas. Um dos diferenciais que mais chamam a atenção do Smartphone Moto G71 é a sua câmera tripla traseira com ótima qualidade, tire fotos mais nítidas até mesmo em ambientes que possuem menos iluminação. Já a câmera frontal, conta com 16MP com resolução incrível. Outro ponto que chama a atenção é a sua bateria de 5000mAh que te traz incrível performance e ainda mais tempo de uso. Ideal para quem necessita utilizar o smartphone por longas horas. Você merece ter o Smartphone Moto G71 da Motorola Imagens meramente ilustrativas.Todas as informações divulgadas são de responsabilidade do Fabricante/Fornecedor.Verifique com os fabricantes do produto e de seus componentes eventuais limitações à utilização de todos os recursos e funcionalidades.A memória interna disponível para o usuário pode variar de acordo com o sistema operacional e aplicativos instalados no dispositivo.",7892597351626,Smartphone Moto G71 128GB 5G Wi-Fi Tela 6.4'' Dual Chip 6GB RAM Câmera Tripla + Selfie 16MP - Azul,https://www.americanas.com.br/produto/4679623721,smartphone moto g71 128gb 5g wi-fi tela 6.4'' dual chip 6gb ram câmera tripla + selfie 16mp - azul,americanas,0
"Modelo - Note 11Ano - 2022Número da peça - Note 11Tipo Do Produto - EletrônicosRAM - 4Capacidade de armazenamento da memória - 6 GBEntradas para memória - 1Tamanho da memória externa - 128Tamanho da memória ram instalada - 4 GBCapacidade de armazenamento digital - 128 GBMarca do processador - QualcommVelocidade do processador - 2.4 GHzTecnologia da tela - lcd, AMOLEDTamanho da tela - 6.43 PolegadasTela ou mostrador - amoled, LCDResolução do sensor óptico - 16 MPBaterias inclusas - SimFunciona com baterias - SimTecnologia celular - 4GTecnologia de conexão - Bluetooth, Wi-fi, USBEntrada de usuário - Tela sensível ao toqueConexões - Bluetooth BluetoothTipo de conector - USB tipo c, Jack de 3,5 mmResolução estática efetiva - 10Peso do produto - 160 gNúmero do modelo - Note 11Dimensões do produto - 16 x 7.39 x 0.81 cm; 160 g",6934177767173,Redmi Note 11 Dual Sim 128gb 6gb Ram Câmera 50MP Tela 6.43 Azul (Global),https://www.americanas.com.br/produto/4986718691,redmi note 11 dual sim 128gb 6gb ram câmera 50mp tela 6.43 azul (global),americanas,Sobre este item    Novo na caixa. O produto é enviado com todos os acessórios relevantes,0887276395036,SAMSUNG SM-G986U Galaxy S20 + 5G Ativado 128GB - Blue Cloud (AT & T),https://www.amazon.com.br/SAMSUNG-SM-G986U-Galaxy-Ativado-128GB/dp/B085PZ311S/ref=sr_1_42?qid=1651784038&s=wireless&sr=1-42,samsung sm-g986u galaxy s20 + 5g ativado 128gb - blue cloud (at & t),amazon,0
"O Redmi Note 10 Pro Max é um produto com poucos concorrentes em termos de multimídia graças à câmera de 108 megapixels que permite ao Redmi Note 10 Pro Max tirar fotos fantásticas com uma resolução de 12000x9000 pixels e gravar vídeos em 4K a espantosa resolução de 3840x2160 pixels. Hardware: os: miui 12, baseado no Android 11 cpu: Snapdragon 732G Octa Core, até 2,3 GHz gpu: Adreno 618 ram: 6GB LPDDR4X rom: 128 gb ufs 2.2 Tela: Tamanho da tela: 6,67 polegadas amoled DotExibição Tipo: fhd + display Dot Drop Taxa de atualização: 120 Hz Taxa de amostragem: até 240Hz Resolução: 2400x1080 pixels, 395PPI Características: Relação de contraste: 4.500.000: 1, Brilho: 450 nits (tipo), hbm 700 nits (tipo), brilho de pico de 1200 nits (tipo), Certificação HDR10, Modo de leitura 3.0, exibição de luz solar 2.0, Certificação sgs Eye Care Exibição -------------------------------------------------------------------------------------------------------- Câmera Traseira: Câmera traseira: 108 mp + 8 mp + 5 mp + 2 mp Quad câmera Câmera grande angular de 108 mp",7892509113922,Note 10 Pro Max 128gb 6gb Ram Dark Night versão india,https://www.americanas.com.br/produto/4454827483,note 10 pro max 128gb 6gb ram dark night versão india,americanas,,7892509121040,"Smartphone Samsung Galaxy S21 FE 5G, Preto, 128GB, 6GB RAM, Processador Octa Core, Câmera Tripla Traseira de 12MP + 12MP + 8MP, Selfie de 32MP, Tela 6.4""",https://www.amazon.com.br/Smartphone-Samsung-Galaxy-Processador-Traseira/dp/B09QXKPMPH/ref=sr_1_320?qid=1651784055&s=wireless&sr=1-320&ufe=app_do%3Aamzn1.fos.95de73c3-5dda-43a7-bd1f-63af03b14751,"smartphone samsung galaxy s21 fe 5g, preto, 128gb, 6gb ram, processador octa core, câmera tripla traseira de 12mp + 12mp + 8mp, selfie de 32mp, tela 6.4""",amazon,0
