descricao_1,ean_1,titulo_1,url_1,titulo_cb_1,loja_1,descricao_2,ean_2,titulo_2,url_2,titulo_cb_2,loja_2,match
"O Moto E20 é um smartphone projetado para oferecer o que você mais precisa para se conectar: tecnologia e agilidade. Ideal para quem valoriza cada momento e precisa dos melhores itens ao lado. Tecnologia nas suas mãos Com a velocidade do processador octa-core, é só tocar ou deslizar que o telefone responde na hora. Alterne facilmente entre os apps abertos. Nunca foi tão simples fazer tudo ao mesmo tempo. Qualidade que você precisa Com câmeras incríveis e de encher os olhos. Os filmes e as videochamadas ficam muito melhores em uma tela ultra-wide. A tela Max Vision de 6,5¿ HD+ tem uma proporção de 20:9 para você ver tudo sem rolar para lá e para cá. Ela cobre 87% do dispositivo: é tela de sobra, mas você ainda consegue usar o telefone com uma mão só tranquilamente. Ninguém merece ficar sem bateria. Com os 4000 mAh da bateria de longa duração, são até 40 horas para você fazer o que quiser sem se preocupar com a carga. Escute músicas, faça chamadas, assista a vídeos na internet e aproveite ao máximo a potência da bateria do Moto E20. Imagens meramente ilustrativas.Todas as informações divulgadas são de responsabilidade do Fabricante/Fornecedor.Verifique com os fabricantes do produto e de seus componentes eventuais limitações à utilização de todos os recursos e funcionalidades.A memória interna disponível para o usuário pode variar de acordo com o sistema operacional e aplicativos instalados no dispositivo.",7892597351411,Smartphone Motorola Moto E20 32GB 4G Wi-Fi Tela 6.5'' Dual Chip 2GB RAM Câmera Dupla + Selfie 5MP - Azul,https://www.americanas.com.br/produto/4120059381,smartphone motorola moto e20 32gb 4g wi-fi tela 6.5'' dual chip 2gb ram câmera dupla + selfie 5mp - azul,americanas,"Informações do produto - Produto 100% original - Aparência impecável - Bateria 80% - 100% ( Bateria original, ou seja, nunca foi trocada) - Produto certificado por nossa equipe especialista em hardware e software Mobile, cujo foi revisado, analisado, testado, higienizado e aprovado dentro dos mais avançados padrões técnicos disponíveis no mercado. Garantimos a sua satisfação, caso contrário, o cliente pode fazer a devolução do aparelho dentro de 7 dias e em caso de defeito em troca do aparelho em 90 dias. - Acompanha cabo apple, chave para slot de chip, caixa conforme imagem no anúncio (Pelo fato do aparelho ser de vitrine, a apple não fornece caixa e acessórios originais) - Nota Fiscal eletrônica - Cliente receberá junto com o aparelho nosso contato direto para servir como um suporte, caso tiver dúvidas ou algum problema com o aparelho, será muito mais rápido e eficiente de resolver. O que é um aparelho de vitrine? Resposta: Aparelhos de exposição ou mostruário importante: Nossa loja trabalha somente com aparelho Grade a, ou seja, produto todo original, sem troca de peças, importado diretamente dos eua (Americano). atenção: Muitos vendedores anunciam produtos Grade B como Grade a, estes aparelhos foram certamente trocado varias peças para ficar em estado de novo, onde a chance de aparecer defeitos no aparelho é muito grande, caso que não acontece conosco, pois todos os nossos produtos sem excessão, são 100% originais. destaque: Explicamos esta situação pois queremos ser mais transparentes possíveis com nossos cliente. Nossos produtos são de procedencia, atendemos todo o brasil e damos todo suporte necessário pós venda, fazendo com que o cliente tenha um atendimento com 100% de eficiência.pós compra: Aprovação de pagamento - Imediatamente encaminhado para setor de embalagem - Emissão da Nota fiscal e Etiqueta de envio - Expedição (Processo todo é feito com rapidez e eficiência para você receber o mais rápido possível na sua casa) Ficamos a disposição!ficha técnica: Modelo: xr Memória: 64GB Sistema operaciona: ios 12 Dimensões: 150,9 x 75,7 x 8,3mm Peso: 194 gramas Tela: 6,1"" - Dados técnicos Processador: Hexa-core 2 processador: 2.25 GHz Dual-Core Vortex, 1,6 GHz Quad-core Tempest Chipset: Apple A12 Bionic gpu: Apple gpu (4-core) Ram: 3GB Memória máxima: 64gb - Tela Polegadas: 6,1"" Resolução: 828x1792 pixel Densidade de pixels: 324 ppi Tipo: ips lcd fps: 60Hz - Câmera Megapixel: 12mp + 12mp Resolução: 4000x3000 pixel Tamanho do sensor: 1/3"" Flash: Quad led Camera Frontal: 7.1 Mp Resolução: 3072x2304 pixel",0000000536035,Iphone xr Preto 64gb vitrine,https://www.americanas.com.br/produto/4931518828,iphone xr preto 64gb vitrine,americanas,0
Todas as informações divulgadas são de responsabilidade do fabricante/fornecedor.Verifique com os fabricantes do produto e de seus componentes eventuais limitações à utilização de todos os recursos e funcionalidades.Imagens Meramente Ilustrativas.,7892509112864,Smartphone Samsung Galaxy A51 128GB 4G Wi-Fi Tela 6.5'' Dual Chip 4GB RAM Câmera Quádrupla + Selfie 32MP - Branco,https://www.americanas.com.br/produto/1442622659,smartphone samsung galaxy a51 128gb 4g wi-fi tela 6.5'' dual chip 4gb ram câmera quádrupla + selfie 32mp - branco,americanas,Todas as informações divulgadas são de responsabilidade do fabricante/fornecedor.Verifique com os fabricantes do produto e de seus componentes eventuais limitações à utilização de todos os recursos e funcionalidades.Imagens Meramente Ilustrativas.,7892509117845,Smartphone Samsung Galaxy S21+ 128GB 5G Wi-Fi Tela 6.7'' Dual Chip 8GB RAM Câmera Tripla + Selfie 10MP - Violeta,https://www.americanas.com.br/produto/2810434142,smartphone samsung galaxy s21+ 128gb 5g wi-fi tela 6.7'' dual chip 8gb ram câmera tripla + selfie 10mp - violeta,americanas,0
"Redmi 9T 128GB 4GB Ram Dual Gray Versão Global O Redmi 9T é um Smartphone completo, bonito, com ótimas câmeras, processador potente e bastante espaço interno! Com o processador Octa Core alinhado com o sistema operacional Android 10, garante fluidez de sobra para o uso, jogue ou use muitos apps ao mesmo tempo sem problemas. A bateria de 6.000 mAh garante excelente autonomia e longas horas longe da tomada. Especificações Linha: Redmi - Modelo: 9T - Nome do sistema operacional: Android - Tamanho da tela: 6.53 polegadas - Resolução da tela: 2340 px x 1080 px - Capacidade da bateria: 6000 mAh - Altura x Largura x Profundidade: 162.3 mm x 77.3 mm x 9.6 mm - Tipo de conector de carregamento: usb-c - Câmeras traseiras e uma frontal: 8 megapixels. - Processador: Octa Core alinhado com o sistema operacional Android 10. - é Dual sim: Sim - Memória interna: 128 gb - Memória ram: 4 gb - Ano de lançamento: 2021 - Peso: 198 g - Com imei: Sim - Operadora: Desbloqueado",6954176809902,Redmi 9T 128GB 4GB Ram Dual Gray Versão Global,https://www.americanas.com.br/produto/4409136552,redmi 9t 128gb 4gb ram dual gray versão global,americanas,"O smartphone Samsung Galaxy S22 Ultra chegou para oferecer a melhor experiência para você Com a tecnologia 5G, processador potente e câmeras de nível profissional, o Samsung Galaxy S22 Ultra é um aparelho de alta qualidade que oferece performance e desempenho em um design fino e elegante, além de ser o primeiro Galaxy S com a S Pen integrada. Vem conhecer: As câmeras do Samsung Galaxy S22 Ultra não deixam ninguém de fora da foto! São 12 MP ultra-wide e 108 MP wide: isso significa que o campo de visão será mais amplo, ou seja, suas fotos de paisagem e com toda a família ficarão ainda melhores :) Fotografar de noite não é um problema! Graças aos avançados recursos de Nightography, as fotos tiradas de noite saem bem nítidas e com excelente qualidade, seja na câmera frontal ou traseira. Processador potente! Se você busca um aparelho rápido, sem travamentos e que te deixe livre para realizar todas as suas atividades sem se preocupar, o Galaxy S22 Ultra é para você! Com processador de 4 nm, ele oferece uma excelente performance e desempenho. O Samsung Galaxy S22 Ultra reúne todo o poder do Note Este é o primeiro Galaxy S que já vem com a S Pen Integrada! O toque da caneta é tão natural quanto a escrita no papel ;) O Samsung Galaxy S22 Ultra é ideal para quem quer um aparelho com um design moderno e que ofereça uma experiência exclusiva com o melhor da tecnologia. Confira abaixo tooodos os detalhes deste lançamento imperdível:",7892509122382,Smartphone Samsung Galaxy S22 Ultra 256GB 5G Wi-Fi Tela 6.8'' Dual Chip 12GB RAM Câmera Quádrupla + Selfie 40MP - Preto,https://www.americanas.com.br/produto/4645251827,smartphone samsung galaxy s22 ultra 256gb 5g wi-fi tela 6.8'' dual chip 12gb ram câmera quádrupla + selfie 40mp - preto,americanas,0
"Prepare-se para abrir o novoEle tem tudo o que você gostaria em um smartphone 5G premium e durável.1 Mas para melhorar, fizemos ele dobrável, com uma tela enorme para que você possa assistir, trabalhar e se divertir como nunca antes. DESIGNCom vocês, nossa grande aberturaDESIGNAbra novas formas de apoiar seu smartphoneGraças ao Modo Flex, o Galaxy Z Fold3 5G revela sua grandeza com a capacidade única de ficar na vertical.2 O design simétrico e equilibrado se abre para que você possa relaxar com a nova geração de smartphones. TAMANHOVá do compacto ao impactoO Galaxy Fold mais fino e mais portátil até hoje, com telas grandes em todos os lados. Dobrado, é um smartphone premium clássico de 6,2 polegadas para usar com uma mão.3 Aberto, você tem uma visão ampla que revela novas possibilidades. Cinema. Trabalho. Diversão. EXPERIÊNCIATudo no seu bolso visão IMERSIVAAbra uma nova forma de assistirQuando o Infinity Flex Display de 7,6 polegadas liga, como em um passe de mágica, a câmera sob o display desaparece, não deixando nada além do que está na tela.5, 6 O Display Infinity Flex amoled de 22,5:18 não tem orifício de câmera, oferecendo uma experiência realmente imersiva. A experiência visual não termina na tela Dynamic amoled 2X. Deixe o Dolby Atmos e os alto-falantes estéreos envolverem você com o som. multi VIEWAproveite ao máximo essa vista incrívelO One ui oferece interações intuitivas como de um pc no espaço extra. Seus aplicativos favoritos agora estão otimizados para aproveitar ao máximo a tela principal do Galaxy Z Fold3 5G, mostrando mais informações de uma vez. Faça o trabalho duro parecer fácil S pen fold EDITIONPara todos os seus momentos de genialidadeA primeira S Pen para smartphone dobrável.8 Escrita natural. A precisão ideal com a caneta na tela. Você pode assistir, fazer chamadas de vídeo e muito mais, sem usar as mãos, com o Modo Flex.2 Ele divide a tela em duas, para que você possa trabalhar de forma mais inteligente, como atender a uma chamada na metade superior e esboçar ideias na metade inferior. Não consegue abrir aplicativos de terceiros no modo Flex? Ative o Labs nas configurações e veja a tela se transformar.9 MULTITAREFASTrês janelas de uma só vezDivida a tela grande em três aplicativos de uma só vez, depois abra mais cinco em janelas pop-up.10, 11 Salve grupos de aplicativos no painel Edge para abrir instantaneamente e trabalhar mais tarde, depois assista, converse e faça muito mais, tudo de uma vez. Seu smartphone oferece a produtividade de um pc, mas cabe dobrado na palma da mão para garantir portabilidade. Funciona perfeitamente com aplicativos Microsoft, para que você tenha acesso a uma estação de trabalho melhor e termine sua lista de tarefas com mais rapidez. Nunca perca um movimentoA frequência de 120 Hz proporciona jogos e imagens suaves na Tela Externa e na tela principal. Ela mantém o movimento nítido e sensível mesmo nos momentos mais cheios de ação para dar a você uma grande vantagem de jogo. O processador de 5 nm mantém você na jogada com mais velocidade. *Jogos em tela cheia na tela principal podem exigir a configuração do Labs no dispositivo Samsung Galaxy. Alguns aplicativos podem não ser suportados pelo Labs. durabilidade E resistente à águao dobro de beleza em cada detalhe Não se preocupe. é resistente à águaO primeiro smartphone dobrável resistente à água do mundo. A classificação IPX8 significa mais liberdade para abrir o novo, mesmo debaixo de chuva. EXTERIORResistenteAbra com mais confiança. O Galaxy Z Fold3 5G é feito de materiais duráveis para que você possa se preocupar menos enquanto dobra, escreve e envia mensagens. Nossa estrutura de alumínio mais resistente até hojeForça para dar tranquilidade e confiança. A estrutura Armor Aluminium principal deste smartphone incrível é leve e super-resistente, 10% mais durável para proteger as partes internas da dobradiça como uma armadura. Projetado para superar as expectativasÉ o nosso vidro mais resis.",7892509120548,"Smartphone Samsung Galaxy Z Fold3 256GB 5G - Verde, ram 12GB, Tela 7.6",https://www.americanas.com.br/produto/4018101643,"smartphone samsung galaxy z fold3 256gb 5g - verde, ram 12gb, tela 7.6",americanas,"Sobre este item    Náo funciona com Verizon/BOOST/CRICKET ou qualquer operadora CDMA. 5G + 4G VoLTE Worldwide Desbloqueado Dual Nano SIM.    5G: n1,n3,n7,n8,n20,n28,n38,n40,n41,n66,n77,n78 / 4G: FDD-LTE Band 1,2,3,4,5,7,8,12,17,20,28,32,66 TDD-LTE Band 38,e / Banda 3G 1,2,4,5,8 / 2G Quad Band    Tela completa de 6,5 polegadas Alta taxa de atualizaááo de 90 Hz Resoluááo: 1080 á— 2400 FHD +    Cámera tripla de 48 MP com modo de foto noturna + cámera frontal de 16 MP    Bateria de 5000 mAh (tipo) suporta carregamento rápido de 18 W    Bluetooth 5.1 / NFC / WiFi 2.4 / GPS 5 GHz / A-GPS / BEIDOU / GALILEO / QZSS / GLONASS FCC ID: 2AFZJ20SG",6934177742798,Celular Xiaomi M3 Pro 64gb azul Versão Global Lacrado,https://www.amazon.com.br/Celular-Xiaomi-Vers%C3%A3o-Global-Lacrado/dp/B0973QYQJY/ref=sr_1_1200?qid=1651784107&s=wireless&sr=1-1200&ufe=app_do%3Aamzn1.fos.95de73c3-5dda-43a7-bd1f-63af03b14751,celular xiaomi m3 pro 64gb azul versão global lacrado,amazon,0
Sobre este item    Android 11 Go Edition    Memória 32GB + 1GB Ram    Processador Quad Core    Bateria de 2000mAh,7908414420243,Smartphone Multilaser E Pro 4G 32GB Wi-Fi 5.0 pol. Dual Chip 1GB RAM Câmera 5MP + 5MP Android 11 (Go edition) Quad Core - Dourado – P9151,https://www.amazon.com.br/Smartphone-Multilaser-Wi-Fi-C%C3%A2mera-Android/dp/B09WF3VSBD/ref=sr_1_1643?qid=1651784133&s=wireless&sr=1-1643&ufe=app_do%3Aamzn1.fos.95de73c3-5dda-43a7-bd1f-63af03b14751,smartphone multilaser e pro 4g 32gb wi-fi 5.0 pol. dual chip 1gb ram câmera 5mp + 5mp android 11 (go edition) quad core - dourado – p9151,amazon,"Sobre este item    Sistema operacional Android 10, MIUI 12 Mediatek Helio G80 processador (12 nm), tela sensível ao toque capacitiva IPS LCD, 16 milhµes de cores    Tamanho 6,5 polegadas, resoluo 1080 x 2340 pixels Corning Gorilla Glass 3 proteo    Compartimento para carto MicroSDXC (compartimento dedicado) cámera principal de 13 MP + 8 MP + 5 MP + cámera selfie de 8 MP    Possui LED flash, HDR, sensores panormicos, impresso digital (montado na parte traseira), acelerómetro, proximidade, bússola, bateria Li-Po 5020 mAh, carregamento rápido de 18 W",6941059645962,Xiaomi Smartphone Redmi 9 Dual Chip 64GB 4GB Sunset Purple - Roxo,https://www.amazon.com.br/Smartphone-Xiaomi-Redmi-Sunset-Purple/dp/B08B3NVQ7V/ref=sr_1_1194?qid=1651784107&s=wireless&sr=1-1194&ufe=app_do%3Aamzn1.fos.95de73c3-5dda-43a7-bd1f-63af03b14751,xiaomi smartphone redmi 9 dual chip 64gb 4gb sunset purple - roxo,amazon,0
,6941059646099,"Celular Xiaomi Redmi 9 Versão Global 64gb / 4gb Ram/Tela 6.53"" - Sunset Purple",https://www.amazon.com.br/Celular-Xiaomi-Redmi-Vers%C3%A3o-Global/dp/B089WC6HCK/ref=sr_1_1104?qid=1651784101&s=wireless&sr=1-1104&ufe=app_do%3Aamzn1.fos.95de73c3-5dda-43a7-bd1f-63af03b14751,"celular xiaomi redmi 9 versão global 64gb / 4gb ram/tela 6.53"" - sunset purple",amazon,Todas as informações divulgadas são de responsabilidade do fabricante/fornecedor. Verifique com os fabricantes do produto e de seus componentes eventuais limitações à utilização de todos os recursos e funcionalidades. Imagens Meramente Ilustrativas.,7892509115940,Smartphone Samsung Galaxy Note 20 256GB 5G Wi-Fi Tela 6.7'' Dual Chip 8GB RAM Câmera Tripla + Selfie 10MP - Mystic Bronze,https://www.americanas.com.br/produto/1962216945,smartphone samsung galaxy note 20 256gb 5g wi-fi tela 6.7'' dual chip 8gb ram câmera tripla + selfie 10mp - mystic bronze,americanas,0
Todas as informações divulgadas são de responsabilidade do fabricante/fornecedor.Verifique com os fabricantes do produto e de seus componentes eventuais limitações à utilização de todos os recursos e funcionalidades.Imagens Meramente Ilustrativas.,0194252014981,"iPhone 12 Mini Apple (128GB) Branco tela 5,4"" Câmera dupla 12MP iOS",https://www.americanas.com.br/produto/2291347450,"iphone 12 mini apple (128gb) branco tela 5,4"" câmera dupla 12mp ios",americanas,"Smartphone Samsung Galaxy A03s 32gb 3gb Ram Tela 6.5 pol. / topshop O Smartphone Galaxy A03s da Samsung foi projetado para apresentar uma tela Super amoled de 6.5 polegadas com resolução de 720 x 1600 pixels e densidade de 270 ppi para uma excelente experiência de visualização. Apresenta sistema de câmera traseira quadrupla de 13 mp + 2 mp + 2 mp + 2 mp para captura de imagens e gravação de vídeo em alta qualidade, bem como câmera frontal de 5MP para você arrasar nas selfies. é equipado com processador Mediatek Helio P35 / Octa-core, o que permite oferecer uma performance de desempenho muito boa na execução de tarefas e aplicativos, dispõe de conectividade Wifi 802.11 e bluetooth 5.0 para maior comodidade, assim como capacidade de bateria de 5.000mAh para que você possa navegar a vontade pela web, jogar seus jogos favoritos e desfrutar ao máximo de todos os recurso por várias horas longe da tomada. Marca: Samsung Cor do produto: Branco Referência do modelo: A037F-DS Processador: MediaTek Helio P35 / Octa-core Gravação Vídeo: fhd (1920 x 1080) a 30 fps Conectividade sem fio: Wi-Fi 802.11 / bluetooth 5.0 Tipo de Slot cartão sim: Dual sim Capacidade de carga da bateria: 5.000 mAh Base Sistema Operacional: Android Dimensões: 10 x 10 x 10 cm Peso: 4000 g Garantia: 90 dias. Venda condicionada à existência de produto em estoque. Prazo de postagem: 5 dias úteis Após recebimento do pedido. Prazo estimado: 35 dias",7908404855017,Smartphone Samsung Galaxy A03s 32gb 3gb Ram Tela 6.5 pol.,https://www.americanas.com.br/produto/4274006320,smartphone samsung galaxy a03s 32gb 3gb ram tela 6.5 pol.,americanas,0
Todas as informações divulgadas são de responsabilidade do fabricante/fornecedor.Verifique com os fabricantes do produto e de seus componentes eventuais limitações à utilização de todos os recursos e funcionalidades.Imagens Meramente Ilustrativas.,7892509123235,"Smartphone Samsung Galaxy A13 128GB 4G Wi-Fi Tela 6.6"" Dual Chip 4GB RAM Câmera Quádrupla + Selfie 8MP - Azul",https://www.americanas.com.br/produto/4807736369,"smartphone samsung galaxy a13 128gb 4g wi-fi tela 6.6"" dual chip 4gb ram câmera quádrupla + selfie 8mp - azul",americanas,Todas as informações divulgadas são de responsabilidade do fabricante/fornecedor.Verifique com os fabricantes do produto e de seus componentes eventuais limitações à utilização de todos os recursos e funcionalidades.Imagens Meramente Ilustrativas.,7892597350988,Smartphone Moto G60 128GB 4G Wi-Fi Tela 6.8'' Dual Chip 6GB RAM Câmera Tripla + Selfie 32MP - Champagne,https://www.americanas.com.br/produto/3171319315,smartphone moto g60 128gb 4g wi-fi tela 6.8'' dual chip 6gb ram câmera tripla + selfie 32mp - champagne,americanas,0
"A tecnologia na palma da sua mão com o Smartphone Motorola Moto E6S Dual Chip Desbloqueado Android Tela 6.1” 32GB 4G Câmera 13MP + 2MP Helio P22 - Vermelho Magenta. Com tela LED de 6.1"" resolução HD+ - 720 x 1560 para visualizar o conteúdo com nitidez e qualidade, memória RAM de 2GB e interna de 32GB, além disso, expansivo microSD de até 512GB. Alta performance com a bateria 3000 MAH para usar seu dispositivo móvel por mais tempo. Um excelente Smartphone para facilitar o seu dia a dia, tanto para o uso pessoal quanto no trabalho. A funcionalidade para garantir que permaneça conectado e antenado as tendências. Todas as informações divulgadas são de responsabilidade do Fabricante/Fornecedor. Verifique com os fabricantes do produto e de seus componentes eventuais limitações à utilização de todos os recursos e funcionalidades. A memória interna disponível para o usuário pode variar de acordo com o sistema operacional e aplicativos instalados no dispositivo.",7892597350018,Smartphone Motorola Moto E6s 32GB 4G Wi-Fi Tela 6.1'' Dual Chip 2GB RAM Câmera Dupla + Selfie 5MP - Pink,https://www.americanas.com.br/produto/2751077658,smartphone motorola moto e6s 32gb 4g wi-fi tela 6.1'' dual chip 2gb ram câmera dupla + selfie 5mp - pink,americanas,"Características principais Marca Motorola Linha Moto g Modelo G4 Play Dual sim é Dual sim Sim Cor Preto Memória interna 16 gb Memória ram 2 gbOutras características Com eSIM Não Nome do sistema operacional Android Versão do sistema operacional 6.0.1 Marshmallow Ano de lançamento 2016 Peso 137 g Altura x Largura x Profundidade 144.4 mm x 72 mm x 9.9 mm Com tela tátil Sim Tamanho da tela 5 "" Resolução da tela 720 px x 1280 px Pixels por polegada 294 ppi Tecnologia de tela ips Com câmera Sim Número de câmeras traseiras 1 Resolução da câmera traseira principal 8 Mpx Resolução de vídeo da câmera traseira 1920 px x 1080 px Abertura do diafragma da câmera traseira f 2.2 Número de câmeras frontais 1 Resolução da câmera frontal principal 5 Mpx Resolução de vídeo da câmera frontal 1920 px x 1080 px Abertura do diafragma da câmera frontal f 2.2 Com flash na câmara frontal Não Rede 4G/LTE Quantidade de ranhuras para cartão sim 2 Tamanhos de cartão sim compatíveis Micro-SIM Tipos de cartão de memória microSD Capacidade máxima do cartão de memória 256 gb Modelo do processador Snapdragon 410 Modelo de cpu 4x1.2 GHz Cortex-A53 Quantidade de núcleos do processador 4 Velocidade do processador 1.2 GHz Modelo de gpu Adreno 306 Com teclado qwerty físico Não Com conector USB Sim Com Wi-Fi Sim Com gps Sim Com Bluetooth Sim Com mini hdmi Não Com radio Sim Com leitor de impressão digital Não Com reconhecimento facial Sim Com acelerômetro Sim Com sensor de proximidade Sim Com giroscópio Não é resistente a salpicos Não é resistente à água Não é à prova d'água Não Tipo de bateria Li-Po Capacidade da bateria 2800 mAh Com bateria removível Sim",7898357810051,Motorola Moto G G4 Play Dual sim 16 gb Preto 2 gb ram,https://www.americanas.com.br/produto/1577239681,motorola moto g g4 play dual sim 16 gb preto 2 gb ram,americanas,0
,7892509118460,"Smartphone Samsung Galaxy A32 128GB Branco 4G - 4GB RAM Tela 6,4” Câm. Quádrupla + Selfie 20MP",https://www.amazon.com.br/Smartphone-Samsung-Galaxy-128GB-Branco/dp/B09313DG9K/ref=sr_1_788?qid=1651784082&s=wireless&sr=1-788,"smartphone samsung galaxy a32 128gb branco 4g - 4gb ram tela 6,4” câm. quádrupla + selfie 20mp",amazon,"Sobre este item    O aparelho celular YC-335 formato flip super simples de utilizar e bateria de longa duração    Possui design exclusivo que permite visualizar a tela do aparelho mesmo estando com a tampa fechada, através de um visor transparente    Permite atendimento comum simplesmente abrindo a tampa    Seu Zoom óptico de 10x garante fotos detalhadas de longe sem sacrificar a resolução ou a qualidade da imagem    É perfeito para quem gosta de ver filmes e jogar no celular    Peso de 70g",7898567772927,"Celular Flip Dual SIM FM Câmera Digital, DL YC335AZU, 32MB, 1.8"", Azul",https://www.amazon.com.br/Telefone-Celular-Flip-DL-YC335AZU/dp/B075TDTT7B/ref=sr_1_2421?qid=1651784173&s=wireless&sr=1-2421&ufe=app_do%3Aamzn1.fos.95de73c3-5dda-43a7-bd1f-63af03b14751,"celular flip dual sim fm câmera digital, dl yc335azu, 32mb, 1.8"", azul",amazon,0
